AIO:ModularLanguageModel,AIO:ModelSubset,Modular LM,,Modular Language Model,FALSE,0.07,"A modular language model consists of multiple specialized components or skills that can be dynamically composed and recombined to solve complex tasks, mimicking the modular structure of human cognition.",,A language model that consists of multiple specialized components or skills that can be dynamically composed and recombined to solve complex tasks mimicking the modular structure of human cognition.,A language model that consists of multiple specialized components or skills that can be dynamically composed and recombined to solve complex tasks mimicking the modular structure of human cognition.,https://arxiv.org/abs/2302.11529v2,,,AIO:LanguageModel
AIO:GenerativeLanguageInterface,AIO:ModelSubset,,Interactive generation,Generative Language Interface,FALSE,0.23,"A generative language interface enables users to engage in an interactive dialogue with an LLM, providing feedback to guide and refine the generated outputs iteratively.",,A language model that enables users to engage in an interactive dialogue with an LLM providing feedback to guide and refine the generated outputs iteratively.,A language model that enables users to engage in an interactive dialogue with an LLM providing feedback to guide and refine the generated outputs iteratively.,,,,AIO:LanguageModel
AIO:AutoregressiveLanguageModel,AIO:ModelSubset,,generative language model|sequence-to-sequence model,Autoregressive Language Model,FALSE,0.28,"An autoregressive language model generates text sequentially, predicting one token at a time based on the previously generated tokens. It excels at natural language generation tasks by modeling the probability distribution over sequences of tokens.",,A language model that generates text sequentially predicting one token at a time based on the previously generated tokens excelling at natural language generation tasks by modeling the probability distribution over sequences of tokens.,A language model that generates text sequentially predicting one token at a time based on the previously generated tokens excelling at natural language generation tasks by modeling the probability distribution over sequences of tokens.,,,,AIO:LanguageModel
AIO:MaskedLanguageModel,AIO:ModelSubset,,bidirectional encoder|denoising autoencoder,Masked Language Model,FALSE,0.16,"A masked language model is trained to predict randomly masked tokens in a sequence, based on the remaining unmasked tokens. This allows it to build deep bidirectional representations that can be effectively transferred to various NLP tasks via fine-tuning.",,A language model that is trained to predict randomly masked tokens in a sequence based on the remaining unmasked tokens allowing it to build deep bidirectional representations that can be effectively transferred to various NLP tasks via fine-tuning.,A language model that is trained to predict randomly masked tokens in a sequence based on the remaining unmasked tokens allowing it to build deep bidirectional representations that can be effectively transferred to various NLP tasks via fine-tuning.,,,,AIO:LanguageModel
AIO:MultimodalLanguageModel,AIO:ModelSubset,Mulimodal LM,,Multimodal Language Model,FALSE,0.22,"A multimodal language model learns joint representations across different modalities like text, vision, and audio in an end-to-end fashion for better cross-modal understanding and generation.",,A language model that learns joint representations across different modalities like text vision and audio in an end-to-end fashion for better cross-modal understanding and generation.,A language model that learns joint representations across different modalities like text vision and audio in an end-to-end fashion for better cross-modal understanding and generation.,https://arxiv.org/abs/2205.12630,,,AIO:LanguageModel
AIO:GraphLanguageModel,AIO:ModelSubset,Graph LM,Structured representations,Graph Language Model,FALSE,0.17,"A graph language model operates over structured inputs or outputs represented as graphs, enabling reasoning over explicit relational knowledge representations during language tasks.",,A language model that operates over structured inputs or outputs represented as graphs enabling reasoning over explicit relational knowledge representations during language tasks.,A language model that operates over structured inputs or outputs represented as graphs enabling reasoning over explicit relational knowledge representations during language tasks.,https://arxiv.org/abs/2401.07105,,,AIO:LanguageModel
AIO:HierarchicalLanguageModel,AIO:ModelSubset,Hierarchical LM,multi-scale representations,Hierarchical Language Model,FALSE,0.10,"A hierarchical language model represents language at multiple levels of granularity, learning hierarchical representations that capture both low-level patterns and high-level abstractions.",,A language model that represents language at multiple levels of granularity learning hierarchical representations that capture both low-level patterns and high-level abstractions.,A language model that represents language at multiple levels of granularity learning hierarchical representations that capture both low-level patterns and high-level abstractions.,https://doi.org/10.1016/j.ipm.2024.103698,,,AIO:LanguageModel
AIO:ImplicitLanguageModel,AIO:ModelSubset,Implicit LM,Energy-based models|Token-level scoring,Implicit Language Model,FALSE,0.22,"An implicit language model uses an energy function to score entire sequences instead of factorizing probabilities autoregressively, better capturing global properties and long-range dependencies.",,A language model that uses an energy function to score entire sequences instead of factorizing probabilities autoregressively better capturing global properties and long-range dependencies.,A language model that uses an energy function to score entire sequences instead of factorizing probabilities autoregressively better capturing global properties and long-range dependencies.,https://arxiv.org/pdf/2303.16189,,,AIO:LanguageModel
AIO:RecursiveLLM,AIO:ModelSubset,Recursive Large Language Model|Self-Attending Large Language Model,self-attention|iterative refinement,Recursive LLM,FALSE,0.18,"A recursive language model uses recursive neural network architectures like TreeLSTMs to learn syntactic composition functions, improving systematic generalization abilities.",,A large language model that uses recursive neural network architectures like TreeLSTMs to learn syntactic composition functions improving systematic generalization abilities.,A language model that uses recursive neural network architectures like TreeLSTMs to learn syntactic composition functions improving systematic generalization abilities.,https://doi.org/10.1609/aaai.v33i01.33017450,,,AIO:LanguageModel
AIO:TransformerLanguageModel,AIO:ModelSubset,Transformer LM,,Transformer Language Model,FALSE,0.19,"A transformer LM is a neural network model that uses the transformer architecture based on multi-head attention mechanisms, allowing it to contextualize tokens within a context window for effective language understanding and generation.",,A language model that uses the transformer architecture based on multi-head attention mechanisms allowing it to contextualize tokens within a context window for effective language understanding and generation.,A language model that uses the transformer architecture based on multi-head attention mechanisms allowing it to contextualize tokens within a context window for effective language understanding and generation.,https://arxiv.org/abs/1706.03762,,,AIO:LanguageModel
AIO:FactoredLanguageModel,AIO:ModelSubset,Factorized Language Model,,Factored Language Model,FALSE,0.38,"A factored language model views each word as a vector of multiple factors, such as part-of-speech, morphology, and semantics, to improve language modeling.",,A language model that views each word as a vector of multiple factors such as part-of-speech morphology and semantics to improve language modeling.,A language model that views each word as a vector of multiple factors such as part-of-speech morphology and semantics to improve language modeling.,https://en.wikipedia.org/wiki/Factored_language_model,,,AIO:LanguageModel
AIO:EncoderDecoderLLM,AIO:ModelSubset,,,Encoder-Decoder LLM,FALSE,#N/A,,,"The LLM introduced in the ""Attention Is All You Need"" paper. The encoder processes the input sequence to generate a hidden representation summarizing the input information, while the decoder uses this hidden representation to generate the desired output sequence.","A large language model introduced in the ""Attention Is All You Need"" paper. The encoder processes the input sequence to generate a hidden representation summarizing the input information, while the decoder uses this hidden representation to generate the desired output sequence.",https://www.practicalai.io/understanding-transformer-model-architectures/#:~:text=Encoder,,,AIO:LargeLanguageModel
AIO:PersonalizedLLM,AIO:ModelSubset,Personalized Large Language Model,user adaptation LLM,Personalized LLM,FALSE,0.38,"A personalized LLM adapts its language modeling and generation to the preferences, style, and persona of individual users or audiences.",,A large language model that adapts its language modeling and generation to the preferences style and persona of individual users or audiences.,A large language model that adapts its language modeling and generation to the preferences style and persona of individual users or audiences.,,,,AIO:LargeLanguageModel
AIO:ControllableLLM,AIO:ModelSubset,Controllable Large Language Model,conditional generation|guided generation,Controllable LLM,FALSE,0.43,"A controllable LLM allows for explicit control over certain attributes of the generated text, such as style, tone, topic, or other desired characteristics, through conditioning or specialized training objectives.","A controllable LLM allows for explicit control over certain attributes of the generated text, such as style, tone, topic, or other desired characteristics, through conditioning or specialized training objectives.",A large language model that allows for explicit control over certain attributes of the generated text such as style tone topic or other desired characteristics through conditioning or specialized training objectives.,A large language model that allows for explicit control over certain attributes of the generated text such as style tone topic or other desired characteristics through conditioning or specialized training objectives.,,,,AIO:LargeLanguageModel
AIO:EvolutionaryLLM,AIO:ModelSubset,Evolutionary Language Model,evolutionary algorithms|genetic programming,Evolutionary LLM,FALSE,0.38,"An evolutionary LLM applies principles of evolutionary computation to optimize its structure and parameters, evolving over time to improve performance.",,A large language model that applies principles of evolutionary computation to optimize its structure and parameters evolving over time to improve performance.,A large language model that applies principles of evolutionary computation to optimize its structure and parameters evolving over time to improve performance.,,,,AIO:LargeLanguageModel
AIO:ContinualLearningLLM,AIO:ModelSubset,CL-Large Language Model|Continual Learning Large Language Model,lifelong learning|catastrophic forgetting,Continual Learning LLM,FALSE,0.31,A continual learning LLM continually acquires new knowledge and skills over time without forgetting previously learned information. This allows the model to adapt and expand its capabilities as new data becomes available.,,A large language model that continually acquires new knowledge and skills over time without forgetting previously learned information allowing the model to adapt and expand its capabilities as new data becomes available.,A large language model that continually acquires new knowledge and skills over time without forgetting previously learned information allowing the model to adapt and expand its capabilities as new data becomes available.,,,,AIO:LargeLanguageModel
AIO:LifelongLearningLLM,AIO:ModelSubset,Continual Learning LLM|Forever Learning,Catastrophic forgetting|Plasticity-Stability balance,Lifelong Learning LLM,FALSE,0.33,"A lifelong learning LLM continually acquires new knowledge over time without forgetting previously learned information, maintaining a balance between plasticity and stability.",,A large language model that continually acquires new knowledge over time without forgetting previously learned information maintaining a balance between plasticity and stability.,A large language model that continually acquires new knowledge over time without forgetting previously learned information maintaining a balance between plasticity and stability.,,,,AIO:LargeLanguageModel
AIO:FactorizedLLM,AIO:ModelSubset,Factorized Large Language Model|Factorized Learning Assisted with Large Language Model,Conditional masking|Product of experts,Factorized LLM,FALSE,0.21,"A factorized LLM decomposes the full language modeling task into multiple sub-components or experts that each focus on a subset of the information, enabling more efficient scaling.",,A large language model that decomposes the full language modeling task into multiple sub-components or experts that each focus on a subset of the information enabling more efficient scaling.,A large language model that decomposes the full language modeling task into multiple sub-components or experts that each focus on a subset of the information enabling more efficient scaling.,https://doi.org/10.48550/arXiv.2403.12556,,,AIO:LargeLanguageModel
AIO:DatatoTextLLM,AIO:ModelSubset,Meaning representation,,Data-to-Text LLM,FALSE,#N/A,,,"A LLM that generates natural language descriptions from structured data sources like tables, graphs, and knowledge bases, requiring grounding in meaning representations.","A large language model that generates natural language descriptions from structured data sources like tables, graphs, and knowledge bases, requiring grounding in meaning representations.",,,,AIO:LargeLanguageModel
AIO:DifferentiableLLM,AIO:ModelSubset,Differentiable Large Language Model,end-to-end training|fully backpropagable,Differentiable LLM,FALSE,0.31,"A differentiable LLM has an architecture amenable to full end-to-end training via backpropagation, without relying on teacher forcing or unlikelihood training objectives.",,A large language model that has an architecture amenable to full end-to-end training via backpropagation without relying on teacher forcing or unlikelihood training objectives.,A large language model that has an architecture amenable to full end-to-end training via backpropagation without relying on teacher forcing or unlikelihood training objectives.,,,,AIO:LargeLanguageModel
AIO:ReasoningLLM,AIO:ModelSubset,Reasoning Large Language Model|Rational Large Language Model,reasoning|logical inferences,Reasoning LLM,FALSE,0.38,"A reasoning LLM incorporates explicit reasoning capabilities, leveraging logical rules, axioms, or external knowledge to make deductive inferences during language tasks.",,A large language model that incorporates explicit reasoning capabilities leveraging logical rules axioms or external knowledge to make deductive inferences during language tasks.,A large language model that incorporates explicit reasoning capabilities leveraging logical rules axioms or external knowledge to make deductive inferences during language tasks.,https://doi.org/10.18653/v1/2023.acl-long.347,,,AIO:LargeLanguageModel
AIO:EmbodiedLLM,AIO:ModelSubset,Embodied Large Language Model,multimodal grounding,Embodied LLM,FALSE,0.42,"An embodied LLM integrates language with other modalities like vision, audio, and robotics to enable grounded language understanding in real-world environments.","An embodied LLM integrates language with other modalities like vision, audio, and robotics to enable grounded language understanding in real-world environments.",A large language model that integrates language with other modalities like vision audio and robotics to enable grounded language understanding in real-world environments.,A large language model that integrates language with other modalities like vision audio and robotics to enable grounded language understanding in real-world environments.,,,,AIO:LargeLanguageModel
AIO:ExplainableLLM,AIO:ModelSubset,Explainable Language Model|XAI LLM,interpretability|model understanding,Explainable LLM,FALSE,0.39,"An explainable LLM is designed to provide insights into its decision-making process, making it easier for users to understand and trust the model's outputs. It incorporates mechanisms for interpreting and explaining its predictions in human-understandable terms.",,A large language model that is designed to provide insights into its decision-making process making it easier for users to understand and trust the model's outputs by incorporating mechanisms for interpreting and explaining its predictions in human-understandable terms.,A large language model that is designed to provide insights into its decision-making process making it easier for users to understand and trust the model's outputs by incorporating mechanisms for interpreting and explaining its predictions in human-understandable terms.,,,,AIO:LargeLanguageModel
AIO:ReinforcementLearningLLM,AIO:ModelSubset,RL-Large Language Model|Reinforcement Learning Large Language Model,reward modeling|decision transformers,Reinforcement Learning LLM,FALSE,0.43,"An RL-LLM is a language model fine-tuned using reinforcement learning, where the model receives rewards for generating text that satisfies certain desired properties or objectives. This can improve the quality, safety, or alignment of generated text.","An RL-LLM is a language model fine-tuned using reinforcement learning, where the model receives rewards for generating text that satisfies certain desired properties or objectives. This can improve the quality, safety, or alignment of generated text.",A large language model that is fine-tuned using reinforcement learning where the model receives rewards for generating text that satisfies certain desired properties or objectives improving the quality safety or alignment of generated text.,A large language model that is fine-tuned using reinforcement learning where the model receives rewards for generating text that satisfies certain desired properties or objectives improving the quality safety or alignment of generated text.,,,,AIO:LargeLanguageModel
AIO:DialogueLLM,AIO:ModelSubset,Dialogue Large Language Model,conversational AI|multi-turn dialogue,Dialogue LLM,FALSE,0.39,"A dialogue LLM is optimized for engaging in multi-turn conversations, understanding context, and generating relevant, coherent responses continuously over many dialogue turns.",,A large language model that is optimized for engaging in multi-turn conversations understanding context and generating relevant coherent responses continuously over many dialogue turns.,A large language model that is optimized for engaging in multi-turn conversations understanding context and generating relevant coherent responses continuously over many dialogue turns.,,,,AIO:LargeLanguageModel
AIO:CurriculumLearningLLM,AIO:ModelSubset,,Learning progression,Curriculum Learning LLM,FALSE,0.30,"A curriculum learning LLM is trained by presenting learning examples in a meaningful order from simple to complex, mimicking the learning trajectory followed by humans.",,A large language model that is trained by presenting learning examples in a meaningful order from simple to complex mimicking the learning trajectory followed by humans.,A large language model that is trained by presenting learning examples in a meaningful order from simple to complex mimicking the learning trajectory followed by humans.,,,,AIO:LargeLanguageModel
AIO:FederatedLLM,AIO:ModelSubset,Federated Large Language Model,privacy-preserving|decentralized training,Federated LLM,FALSE,0.34,"A federated LLM is trained in a decentralized manner across multiple devices or silos, without directly sharing private data. This enables collaborative training while preserving data privacy and security.",,A large language model that is trained in a decentralized manner across multiple devices or silos without directly sharing private data enabling collaborative training while preserving data privacy and security.,A large language model that is trained in a decentralized manner across multiple devices or silos without directly sharing private data enabling collaborative training while preserving data privacy and security.,,,,AIO:LargeLanguageModel
AIO:MultilingualLLM,AIO:ModelSubset,Multilingual Large Language Model,cross-lingual transfer,Multilingual LLM,FALSE,0.27,"A multilingual LLM is trained on text from multiple languages, learning shared representations that enable zero-shot or few-shot transfer to new languages.",,A large language model that is trained on text from multiple languages learning shared representations that enable zero-shot or few-shot transfer to new languages.,A large language model that is trained on text from multiple languages learning shared representations that enable zero-shot or few-shot transfer to new languages.,,,,AIO:LargeLanguageModel
AIO:UnsupervisedLLM,AIO:ModelSubset,Unsupervised Large Language Model,self-supervised,Unsupervised LLM,FALSE,0.36,"An unsupervised LLM is trained solely on unlabeled data using self-supervised objectives like masked language modeling, without any supervised fine-tuning.",,A large language model that is trained solely on unlabeled data using self-supervised objectives like masked language modeling without any supervised fine-tuning.,A large language model that is trained solely on unlabeled data using self-supervised objectives like masked language modeling without any supervised fine-tuning.,,,,AIO:LargeLanguageModel
AIO:OrdinalLLM,AIO:ModelSubset,Ordinal Large Language Model,ranking|preference modeling,Ordinal LLM,FALSE,0.33,"An ordinal LLM is trained to model ordinal relationships and rank outputs, rather than model probability distributions over text sequences directly.",,A large language model that is trained to model ordinal relationships and rank outputs rather than model probability distributions over text sequences directly.,A large language model that is trained to model ordinal relationships and rank outputs rather than model probability distributions over text sequences directly.,,,,AIO:LargeLanguageModel
AIO:ContrastiveLearningLLM,AIO:ModelSubset,,Representation learning,Contrastive Learning LLM,FALSE,0.25,"A contrastive learning LLM is trained to pull semantically similar samples closer together and push dissimilar samples apart in the representation space, learning high-quality features useful for downstream tasks.",,A large language model that is trained to pull semantically similar samples closer together and push dissimilar samples apart in the representation space learning high-quality features useful for downstream tasks.,A large language model that is trained to pull semantically similar samples closer together and push dissimilar samples apart in the representation space learning high-quality features useful for downstream tasks.,,,,AIO:LargeLanguageModel
AIO:GenerativeCommonsenseLLM,AIO:ModelSubset,Generative Commonsense Large Language Model|World Model,physical reasoning|causal modeling,Generative Commonsense LLM,FALSE,0.38,"A generative commonsense LLM is trained to understand and model basic physics, causality, and common sense about how the real world works.",,A large language model that is trained to understand and model basic physics causality and common sense about how the real world works.,A large language model that is trained to understand and model basic physics causality and common sense about how the real world works.,https://arxiv.org/abs/2306.12672,,,AIO:LargeLanguageModel
AIO:CompositionalGeneralizationLLM,AIO:ModelSubset,Compositional Generalization Large Language Model,systematic generalization|out-of-distribution generalization,Compositional Generalization LLM,FALSE,0.24,"A compositional generalization LLM is trained to understand and recombine the underlying compositional structures in language, enabling better generalization to novel combinations and out-of-distribution examples.",,A large language model that is trained to understand and recombine the underlying compositional structures in language enabling better generalization to novel combinations and out-of-distribution examples.,A large language model that is trained to understand and recombine the underlying compositional structures in language enabling better generalization to novel combinations and out-of-distribution examples.,,,,AIO:LargeLanguageModel
AIO:EthicalLLM,AIO:ModelSubset,Ethical Large Language Model,value alignment|constituitional AI,Ethical LLM,FALSE,0.38,"An ethical LLM is trained to uphold certain ethical principles, values, or rules in its language generation to increase safety and trustworthiness.",,A large language model that is trained to uphold certain ethical principles values or rules in its language generation to increase safety and trustworthiness.,A large language model that is trained to uphold certain ethical principles values or rules in its language generation to increase safety and trustworthiness.,,,,AIO:LargeLanguageModel
