ID,Category,Synomyms,Related synonyms,Name,ExactSynonym and label identical,description jaccard diff,Legacy Description,description details comment,Claude opus Aristotelian definition,Curated Claude opus Aristotelian definition,Reference (DOI),Layers comment,layer parts,Parent
ID,AI oio:inSubset  SPLIT=|,A oio:hasExactSynonym SPLIT=|,A oio:hasRelatedSynonym SPLIT=|,LABEL,,,,A rdfs:comment,,A IAO:0000115,>AI oio:hasDbXref  SPLIT=|,A rdfs:comment,SC BFO:0000051 some % SPLIT=|,SC % SPLIT=|
AIO:SoftmaxFunction,AIO:FunctionSubset|AIO:ActivationFunctionSubset,,,Softmax Function,FALSE,0.70,"The elements of the output vector are in range (0, 1) and sum to 1. Each vector is handled independently. The axis argument sets which axis of the input the function is applied along. Softmax is often used as the activation for the last layer of a classification network because the result could be interpreted as a probability distribution. The softmax of each vector x is computed as exp(x) / tf.reduce_sum(exp(x)). The input values in are the log-odds of the resulting probability.","The elements of the output vector are in range (0, 1) and sum to 1. Each vector is handled independently. The axis argument sets which axis of the input the function is applied along. Softmax is often used as the activation for the last layer of a classification network because the result could be interpreted as a probability distribution. The softmax of each vector x is computed as exp(x) / tf.reduce_sum(exp(x)). The input values in are the log-odds of the resulting probability.",An activation function where the elements of the output vector are in range (0 1) and sum to 1 and each vector is handled independently.,A mathematical function where the elements of the output vector are in range (0 1) and sum to 1 and each vector is handled independently.,https://www.tensorflow.org/api_docs/python/tf/keras/activations/softmax,,,AIO:MathematicalFunction
AIO:SigmoidFunction,AIO:FunctionSubset|AIO:ActivationFunctionSubset,tore,,Sigmoid Function,FALSE,0.66,"Applies the sigmoid activation function sigmoid(x) = 1 / (1 + exp(-x)). For small values (<-5), sigmoid returns a value close to zero, and for large values (>5) the result of the function gets close to 1. Sigmoid is equivalent to a 2-element Softmax, where the second element is assumed to be zero. The sigmoid function always returns a value between 0 and 1.","Applies the sigmoid activation function sigmoid(x) = 1 / (1 + exp(-x)). For small values (<-5), sigmoid returns a value close to zero, and for large values (>5) the result of the function gets close to 1. Sigmoid is equivalent to a 2-element Softmax, where the second element is assumed to be zero. The sigmoid function always returns a value between 0 and 1.",An activation function that applies the sigmoid activation function sigmoid(x) = 1 / (1 + exp(-x)) always returning a value between 0 and 1.,A mathematical function that applies the sigmoid activation function sigmoid(x) = 1 / (1 + exp(-x)) always returning a value between 0 and 1.,https://www.tensorflow.org/api_docs/python/tf/keras/activations/sigmoid,,,AIO:MathematicalFunction
AIO:LinearFunction,AIO:FunctionSubset|AIO:ActivationFunctionSubset,,,Linear Function,FALSE,0.36,A linear function has the form f(x) = a + bx.,,An activation function that has the form f(x) = a + bx.,A mathematical function that has the form f(x) = a + bx.,https://www.tensorflow.org/api_docs/python/tf/keras/activations/linear,,,AIO:MathematicalFunction
AIO:SoftplusFunction,AIO:FunctionSubset|AIO:ActivationFunctionSubset,,,Softplus Function,FALSE,0.64,softplus(x) = log(exp(x) + 1),softplus(x) = log(exp(x) + 1),An activation function that is softplus(x) = log(exp(x) + 1).,A mathematical function that is softplus(x) = log(exp(x) + 1).,https://www.tensorflow.org/api_docs/python/tf/keras/activations/softplus,,,AIO:MathematicalFunction
AIO:SoftsignFunction,AIO:FunctionSubset|AIO:ActivationFunctionSubset,,,Softsign Function,FALSE,0.54,softsign(x) = x / (abs(x) + 1),softsign(x) = x / (abs(x) + 1),An activation function that is softsign(x) = x / (abs(x) + 1).,A mathematical function that is softsign(x) = x / (abs(x) + 1).,https://www.tensorflow.org/api_docs/python/tf/keras/activations/softsign,,,AIO:MathematicalFunction
AIO:TanhFunction,AIO:FunctionSubset|AIO:ActivationFunctionSubset,hyperbolic tangent,,Tanh Function,FALSE,0.70,Hyperbolic tangent activation function.,Hyperbolic tangent activation function.,An activation function that is the hyperbolic tangent activation function.,A mathematical function that is the hyperbolic tangent activation function.,https://www.tensorflow.org/api_docs/python/tf/keras/activations/tanh,,,AIO:MathematicalFunction
AIO:ELUFunction,AIO:FunctionSubset|AIO:ActivationFunctionSubset,Exponential Linear Unit|ELU,,ELU Function,FALSE,0.68,The exponential linear unit (ELU) with alpha > 0 is: x if x > 0 and alpha * (exp(x) - 1) if x < 0 The ELU hyperparameter alpha controls the value to which an ELU saturates for negative net inputs. ELUs diminish the vanishing gradient effect. ELUs have negative values which pushes the mean of the activations closer to zero. Mean activations that are closer to zero enable faster Learning as they bring the gradient closer to the natural gradient. ELUs saturate to a negative value when the argument gets smaller. Saturation means a small derivative which decreases the variation and the information that is propagated to the next layer.,The exponential linear unit (ELU) with alpha > 0 is: x if x > 0 and alpha * (exp(x) - 1) if x < 0 The ELU hyperparameter alpha controls the value to which an ELU saturates for negative net inputs. ELUs diminish the vanishing gradient effect. ELUs have negative values which pushes the mean of the activations closer to zero. Mean activations that are closer to zero enable faster Learning as they bring the gradient closer to the natural gradient. ELUs saturate to a negative value when the argument gets smaller. Saturation means a small derivative which decreases the variation and the information that is propagated to the next layer.,An activation function that is x if x > 0 and alpha * (exp(x) - 1) if x < 0 where alpha controls the value to which an ELU saturates for negative net inputs.,A mathematical function that is x if x > 0 and alpha * (exp(x) - 1) if x < 0 where alpha controls the value to which an ELU saturates for negative net inputs.,https://www.tensorflow.org/api_docs/python/tf/keras/activations/elu,,,AIO:MathematicalFunction
AIO:SwishFunction,AIO:FunctionSubset|AIO:ActivationFunctionSubset,,,Swish Function,FALSE,0.56,"x*sigmoid(x). It is a smooth, non-monotonic function that consistently matches or outperforms ReLU on deep networks, it is unbounded above and bounded below.","x*sigmoid(x). It is a smooth, non-monotonic function that consistently matches or outperforms ReLU on deep networks, it is unbounded above and bounded below.",An activation function that is x*sigmoid(x) a smooth non-monotonic function that consistently matches or outperforms ReLU on deep networks.,A mathematical function that is x*sigmoid(x) a smooth non-monotonic function that consistently matches or outperforms ReLU on deep networks.,https://www.tensorflow.org/api_docs/python/tf/keras/activations/swish,,,AIO:MathematicalFunction
AIO:SELUFunction,AIO:FunctionSubset|AIO:ActivationFunctionSubset,Scaled Exponential Linear Unit|SELU,,SELU Function,FALSE,0.16,The SELU activation function multiplies scale (> 1) with the output of the ELU function to ensure a slope larger than one for positive inputs.,,An activation function that multiplies scale (> 1) with the output of the ELU function to ensure a slope larger than one for positive inputs.,A mathematical function that multiplies scale (> 1) with the output of the ELU function to ensure a slope larger than one for positive inputs.,https://www.tensorflow.org/api_docs/python/tf/keras/activations/selu,,,AIO:MathematicalFunction
AIO:ReLUFunction,AIO:FunctionSubset|AIO:ActivationFunctionSubset,Rectified Linear Unit|ReLU,,ReLU Function,FALSE,0.50,"The ReLU activation function returns: max(x, 0), the element-wise maximum of 0 and the input tensor.","The ReLU activation function returns: max(x, 0), the element-wise maximum of 0 and the input tensor.",An activation function that returns max(x 0) the element-wise maximum of 0 and the input tensor.,A mathematical function that returns max(x 0) the element-wise maximum of 0 and the input tensor.,https://www.tensorflow.org/api_docs/python/tf/keras/activations/relu,,,AIO:MathematicalFunction
AIO:LazyInstanceNorm1DLayer,AIO:LayerSubset|AIO:InstanceNormalizationLayerSubset,LazyInstanceNorm1D|LazyInstanceNorm1D|LazyInstanceNorm1D,,LazyInstanceNorm1D Layer,FALSE,0.81,A torch.nn.InstanceNorm1D module with lazy initialization of the num_features argument of the InstanceNorm1D that is inferred from the input.size(1).,A torch.nn.InstanceNorm1D module with lazy initialization of the num_features argument of the InstanceNorm1D that is inferred from the input.size(1).,An instance normalization layer that lazily initializes the num_features argument from the input size for 1D data.,A normalization layer that lazily initializes the num_features argument from the input size for 1D data.,https://pytorch.org/docs/stable/nn.html#normalization-layers,,,AIO:NormalizationLayer
AIO:LazyInstanceNorm2DLayer,AIO:LayerSubset|AIO:InstanceNormalizationLayerSubset,LazyInstanceNorm2D|LazyInstanceNorm2D|LazyInstanceNorm2D,,LazyInstanceNorm2D Layer,FALSE,0.81,A torch.nn.InstanceNorm2D module with lazy initialization of the num_features argument of the InstanceNorm2D that is inferred from the input.size(1).,A torch.nn.InstanceNorm2D module with lazy initialization of the num_features argument of the InstanceNorm2D that is inferred from the input.size(1).,An instance normalization layer that lazily initializes the num_features argument from the input size for 2D data.,A normalization layer that lazily initializes the num_features argument from the input size for 2D data.,https://pytorch.org/docs/stable/nn.html#normalization-layers,,,AIO:NormalizationLayer
AIO:LazyInstanceNorm3DLayer,AIO:LayerSubset|AIO:InstanceNormalizationLayerSubset,LazyInstanceNorm3D|LazyInstanceNorm3D|LazyInstanceNorm3D,,LazyInstanceNorm3D Layer,FALSE,0.81,A torch.nn.InstanceNorm3D module with lazy initialization of the num_features argument of the InstanceNorm3D that is inferred from the input.size(1).,A torch.nn.InstanceNorm3D module with lazy initialization of the num_features argument of the InstanceNorm3D that is inferred from the input.size(1).,An instance normalization layer that lazily initializes the num_features argument from the input size for 3D data.,A normalization that lazily initializes the num_features argument from the input size for 3D data.,https://pytorch.org/docs/stable/nn.html#normalization-layers,,,AIO:NormalizationLayer
AIO:BatchNorm1DLayer,AIO:LayerSubset,BatchNorm1D|BatchNorm1D|BatchNorm1D,,BatchNorm1D Layer,FALSE,0.78,Applies Batch Normalization over a 2D or 3D input as described in the paper Batch Normalization: Accelerating Deep Network Training by Reducing Internal Covariate Shift .,Applies Batch Normalization over a 2D or 3D input as described in the paper Batch Normalization: Accelerating Deep Network Training by Reducing Internal Covariate Shift .,A batch normalization layer that applies Batch Normalization over a 2D or 3D input.,A batch normalization layer that applies Batch Normalization over a 2D or 3D input.,https://pytorch.org/docs/stable/nn.html#normalization-layers,,,AIO:BatchNormalizationLayer
AIO:BatchNorm2DLayer,AIO:LayerSubset,BatchNorm2D|BatchNorm2D|BatchNorm2D,,BatchNorm2D Layer,FALSE,0.87,Applies Batch Normalization over a 4D input (a mini-batch of 2D inputs with additional channel dimension) as described in the paper Batch Normalization: Accelerating Deep Network Training by Reducing Internal Covariate Shift .,Applies Batch Normalization over a 4D input (a mini-batch of 2D inputs with additional channel dimension) as described in the paper Batch Normalization: Accelerating Deep Network Training by Reducing Internal Covariate Shift .,A batch normalization layer that applies Batch Normalization over a 4D input.,A batch normalization layer that applies Batch Normalization over a 4D input.,https://pytorch.org/docs/stable/nn.html#normalization-layers,,,AIO:BatchNormalizationLayer
AIO:BatchNorm3DLayer,AIO:LayerSubset,BatchNorm3D|BatchNorm3D|BatchNorm3D,,BatchNorm3D Layer,FALSE,0.87,Applies Batch Normalization over a 5D input (a mini-batch of 3D inputs with additional channel dimension) as described in the paper Batch Normalization: Accelerating Deep Network Training by Reducing Internal Covariate Shift .,Applies Batch Normalization over a 5D input (a mini-batch of 3D inputs with additional channel dimension) as described in the paper Batch Normalization: Accelerating Deep Network Training by Reducing Internal Covariate Shift .,A batch normalization layer that applies Batch Normalization over a 5D input.,A batch normalization layer that applies Batch Normalization over a 5D input.,https://pytorch.org/docs/stable/nn.html#normalization-layers,,,AIO:BatchNormalizationLayer
AIO:SyncBatchNormLayer,AIO:LayerSubset,SyncBatchNorm|SyncBatchNorm,,SyncBatchNorm Layer,FALSE,0.95,Applies Batch Normalization over a N-Dimensional input (a mini-batch of [N-2]D inputs with additional channel dimension) as described in the paper Batch Normalization: Accelerating Deep Network Training by Reducing Internal Covariate Shift .,Applies Batch Normalization over a N-Dimensional input (a mini-batch of [N-2]D inputs with additional channel dimension) as described in the paper Batch Normalization: Accelerating Deep Network Training by Reducing Internal Covariate Shift .,A batch normalization layer that applies synchronous Batch Normalization across multiple devices.,A batch normalization layer that applies synchronous Batch Normalization across multiple devices.,https://pytorch.org/docs/stable/nn.html#normalization-layers,,,AIO:BatchNormalizationLayer
AIO:LazyBatchNorm1DLayer,AIO:LayerSubset,LazyBatchNorm1D|LazyBatchNorm1D|LazyBatchNorm1D,,LazyBatchNorm1D Layer,FALSE,0.77,A torch.nn.BatchNorm1D module with lazy initialization of the num_features argument of the BatchNorm1D that is inferred from the input.size(1).,A torch.nn.BatchNorm1D module with lazy initialization of the num_features argument of the BatchNorm1D that is inferred from the input.size(1).,A batch normalization layer that lazily initializes the num_features argument from the input size for 1D data.,A batch normalization layer that lazily initializes the num_features argument from the input size for 1D data.,https://pytorch.org/docs/stable/nn.html#normalization-layers,,,AIO:BatchNormalizationLayer
AIO:LazyBatchNorm2DLayer,AIO:LayerSubset,LazyBatchNorm2D|LazyBatchNorm2D|LazyBatchNorm2D,,LazyBatchNorm2D Layer,FALSE,0.77,A torch.nn.BatchNorm2D module with lazy initialization of the num_features argument of the BatchNorm2D that is inferred from the input.size(1).,A torch.nn.BatchNorm2D module with lazy initialization of the num_features argument of the BatchNorm2D that is inferred from the input.size(1).,A batch normalization layer that lazily initializes the num_features argument from the input size for 2D data.,A batch normalization layer that lazily initializes the num_features argument from the input size for 2D data.,https://pytorch.org/docs/stable/nn.html#normalization-layers,,,AIO:BatchNormalizationLayer
AIO:LazyBatchNorm3DLayer,AIO:LayerSubset,LazyBatchNorm3D|LazyBatchNorm3D|LazyBatchNorm3D,,LazyBatchNorm3D Layer,FALSE,0.77,A torch.nn.BatchNorm3D module with lazy initialization of the num_features argument of the BatchNorm3D that is inferred from the input.size(1).,A torch.nn.BatchNorm3D module with lazy initialization of the num_features argument of the BatchNorm3D that is inferred from the input.size(1).,A batch normalization layer that lazily initializes the num_features argument from the input size for 3D data.,A batch normalization layer that lazily initializes the num_features argument from the input size for 3D data.,https://pytorch.org/docs/stable/nn.html#normalization-layers,,,AIO:BatchNormalizationLayer
AIO:ComputationalBias,AIO:BiasSubset,Statistical Bias,,Computational Bias,FALSE,0.29,,,A bias caused by differences between results and facts in the process of data analysis (including the source of data the estimator chose) and analysis methods.,A bias caused by differences between results and facts in the process of data analysis (including the source of data the estimator chose) and analysis methods.,https://doi.org/10.6028/NIST.SP.1270,,,AIO:Bias
AIO:IndividualBias,AIO:BiasSubset,,,Individual Bias,FALSE,0.32,"A persistent point of view or limited list of such points of view applied by an individual, such as ""parent,"" ""academic,"" or ""professional.""",,A persistent point of view or limited list of such points of view applied by an individual.,"A bias characterized by a persistent point of view or limited list of such points of view, applied by an individual.",https://develop.consumerium.org/wiki/Individual_bias,,,AIO:Bias
AIO:SocietalBias,AIO:BiasSubset,,,Societal Bias,FALSE,0.33,"Bias characterized by being for or against groups or individuals based on social identities, demographic factors, or immutable physical characteristics, often manifesting as stereotypes.",,A bias characterized by being for or against groups or individuals based on social identities demographic factors or immutable physical characteristics often manifesting as stereotypes.,A systemic bias characterized by being for or against groups or individuals based on social identities demographic factors or immutable physical characteristics often manifesting as stereotypes.,https://doi.org/10.6028/NIST.SP.1270,,,AIO:SystemicBias
AIO:HistoricalBias,AIO:BiasSubset,,,Historical Bias,FALSE,0.69,"Long-standing biases encoded in society over time, distinct from biases in historical description or the interpretation of history, such as viewing the larger world from a Western or European perspective.","Long-standing biases encoded in society over time, distinct from biases in historical description or the interpretation of history, such as viewing the larger world from a Western or European perspective.",A bias characterized by long-standing biases encoded in society over time distinct from biases in historical description or interpretation.,A bias characterized by long-standing biases encoded in society over time distinct from biases in historical description or interpretation.,https://doi.org/10.6028/NIST.SP.1270,,,AIO:Bias
AIO:SunkCostFallacyBias,AIO:BiasSubset,Sunk Cost Fallacy,,Sunk Cost Fallacy Bias,FALSE,0.40,"The tendency to continue an endeavor due to previously invested resources, despite costs outweighing benefits.","The tendency to continue an endeavor due to previously invested resources, despite costs outweighing benefits.",A bias characterized by the tendency to continue an endeavor due to previously invested resources despite costs outweighing benefits.,A bias characterized by the tendency to continue an endeavor due to previously invested resources despite costs outweighing benefits.,https://doi.org/10.6028/NIST.SP.1270,,,AIO:Bias
AIO:InstitutionalBias,AIO:BiasSubset,,,Institutional Bias,FALSE,0.43,"Bias exhibited at the level of entire institutions, where practices or norms result in the favoring or disadvantaging of certain social groups, such as institutional racism or sexism.","Bias exhibited at the level of entire institutions, where practices or norms result in the favoring or disadvantaging of certain social groups, such as institutional racism or sexism.",A bias exhibited at the level of entire institutions where practices or norms result in the favoring or disadvantaging of certain social groups.,A systemic bias exhibited at the level of entire institutions where practices or norms result in the favoring or disadvantaging of certain social groups.,https://doi.org/10.6028/NIST.SP.1270,,,AIO:SystemicBias
AIO:HumanBias,AIO:BiasSubset,,,Human Bias,FALSE,0.39,"Systematic errors in human thought based on heuristic principles, leading to simplified judgmental operations.",,A systematic error in human thought based on heuristic principles leading to simplified judgmental operations.,A bias in human thought based on heuristic principles leading to simplified judgmental operations.,https://doi.org/10.6028/NIST.SP.1270,,,AIO:Bias
AIO:SystemicBias,AIO:BiasSubset,,,Systemic Bias,FALSE,0.15,Biases resulting from procedures and practices of particular institutions that operate in ways which result in certain social groups being advantaged or favored and others being disadvantaged or devalued.,,A bias resulting from procedures and practices of institutions that operate in ways which result in certain social groups being advantaged or favored and others being disadvantaged or devalued.,A bias resulting from procedures and practices of systems that operate in ways which result in certain social groups being advantaged or favored and others being disadvantaged or devalued.,https://doi.org/10.6028/NIST.SP.1270,,,AIO:Bias
AIO:SupervisedBiclustering,AIO:MachineLearningSubset,Supervised Block Clustering|Supervised Co-clustering|Supervised Two-mode Clustering|Supervised Two-way Clustering|Supervised Joint Clustering,,Supervised Biclustering,FALSE,0.36,"Methods that simultaneously cluster the rows and columns of a labeled matrix, considering data labels to enhance cluster coherence.",,A biclustering task focused on methods that simultaneously cluster the rows and columns of a labeled matrix considering data labels to enhance cluster coherence.,A biclustering task focused on methods that simultaneously cluster the rows and columns of a labeled matrix considering data labels to enhance cluster coherence.,https://en.wikipedia.org/wiki/Biclustering,,,AIO:Biclustering
AIO:UnsupervisedBiclustering,AIO:MachineLearningSubset,Unsupervised Block Clustering|Unsupervised Co-clustering|Unsupervised Two-mode Clustering|Unsupervised Two-way Clustering|Unsupervised Joint Clustering,,Unsupervised Biclustering,FALSE,0.28,Methods that simultaneously cluster the rows and columns of an unlabeled input matrix to identify submatrices with coherent patterns.,,A biclustering task focused on methods that simultaneously cluster the rows and columns of an unlabeled input matrix to identify submatrices with coherent patterns.,A biclustering task focused on methods that simultaneously cluster the rows and columns of an unlabeled input matrix to identify submatrices with coherent patterns.,https://en.wikipedia.org/wiki/Biclustering,,,AIO:Biclustering
AIO:RestrictedBoltzmannMachine,AIO:NetworkSubset,RBM,,Restricted Boltzmann Machine,FALSE,0.35,A restricted Boltzmann machine (RBM) is a generative stochastic neural network that learns the probability distribution of its input data.,,A Boltzmann machine network that learns the probability distribution of its input data.,A Boltzmann machine network that learns the probability distribution of its input data.,https://en.wikipedia.org/wiki/Restricted_Boltzmann_machine,"Layers: Backfed Input, Probabilistic Hidden",AIO:BackfedInputLayer|AIO:ProbabilisticHiddenLayer,AIO:BoltzmannMachineNetwork
AIO:CategoryEncodingLayer,AIO:LayerSubset,,,CategoryEncoding Layer,FALSE,0.78,"A preprocessing layer which encodes integer features. This layer provides options for condensing data into a categorical encoding when the total number of tokens are known in advance. It accepts integer values as inputs, and it outputs a dense or sparse representation of those inputs. For integer inputs where the total number of tokens is not known, use tf.keras.layers.IntegerLookup instead.","A preprocessing layer which encodes integer features. This layer provides options for condensing data into a categorical encoding when the total number of tokens are known in advance. It accepts integer values as inputs, and it outputs a dense or sparse representation of those inputs. For integer inputs where the total number of tokens is not known, use tf.keras.layers.IntegerLookup instead.",A categorical features preprocessing layer that encodes integer features providing options for condensing data into a categorical encoding.,A categorical features preprocessing layer that encodes integer features providing options for condensing data into a categorical encoding.,https://www.tensorflow.org/api_docs/python/tf/keras/layers/CategoryEncoding,,,AIO:CategoricalFeaturesPreprocessingLayer
AIO:IntegerLookupLayer,AIO:LayerSubset,,,IntegerLookup Layer,FALSE,0.25,A preprocessing layer which maps integer features to contiguous ranges.,,A categorical features preprocessing layer that maps integer features to contiguous ranges.,A categorical features preprocessing layer that maps integer features to contiguous ranges.,https://www.tensorflow.org/api_docs/python/tf/keras/layers/IntegerLookup,,,AIO:CategoricalFeaturesPreprocessingLayer
AIO:StringLookupLayer,AIO:LayerSubset,,,StringLookup Layer,FALSE,0.25,A preprocessing layer which maps string features to integer indices.,,A categorical features preprocessing layer that maps string features to integer indices.,A categorical features preprocessing layer that maps string features to integer indices.,https://www.tensorflow.org/api_docs/python/tf/keras/layers/StringLookup,,,AIO:CategoricalFeaturesPreprocessingLayer
