AIO:NaturalLanguageProcessing,AIO:MachineLearningSubset,NLP,,Natural Language Processing,FALSE,0.28,"A subfield of linguistics, computer science, and artificial intelligence focused on the interactions between computers and human language, including programming computers to process and analyze large amounts of natural language data.",,A subfield of machine learning focused on the interactions between computers and human language including programming computers to process and analyze large amounts of natural language data.,A machine learning task focused on the interactions between computers and human language including programming computers to process and analyze large amounts of natural language data.,https://en.wikipedia.org/wiki/Natural_language_processing,,,AIO:MachineLearningTask
AIO:ProbabilisticGraphicalModel,AIO:MachineLearningSubset,PGM|Graphical Model|Structure Probabilistic Model,,Probabilistic Graphical Model,FALSE,0.18,A probabilistic model in which a graph expresses the conditional dependence structure between random variables.,,A machine learning model in which a graph expresses the conditional dependence structure between random variables.,A machine learning task in which a graph expresses the conditional dependence structure between random variables.,https://en.wikipedia.org/wiki/Graphical_model,,,AIO:MachineLearningTask
AIO:MetaLearning,AIO:NetworkSubset,,,Meta-Learning,FALSE,#N/A,,,A machine learning that automatically learns from metadata about machine learning experiments.,A machine learning task that automatically learns from metadata about machine learning experiments.,https://doi.org/10.6028/NIST.SP.1270,,,AIO:MachineLearningTask
AIO:word2vec,AIO:NetworkSubset,W2V,,word2vec,FALSE,#N/A,,,"A machine learning that generates distributed representations of words by training a shallow neural network model, which aims to predict the context of each word within a corpus. This algorithm captures semantic meanings of words through their contextual usage in the text.","A machine learning task that generates distributed representations of words by training a shallow neural network model, which aims to predict the context of each word within a corpus. This algorithm captures semantic meanings of words through their contextual usage in the text.",https://en.wikipedia.org/wiki/Word2vec,"Layers: Input, Hidden, Output",AIO:InputLayer|AIO:HiddenLayer|AIO:OutputLayer,AIO:MachineLearningTask
AIO:KnearestNeighborAlgorithm,AIO:MachineLearningSubset,KNN|K-NN,,K-nearest Neighbor Algorithm,FALSE,#N/A,,,"A machine learning that groups objects by a plurality vote of its neighbors, assigning each object to the class most common among its k nearest neighbors.","A machine learning task that groups objects by a plurality vote of its neighbors, assigning each object to the class most common among its k nearest neighbors.",https://en.wikipedia.org/wiki/K-nearest_neighbors_algorithm|,,,AIO:MachineLearningTask
AIO:SelfsupervisedLearning,AIO:MachineLearningSubset,,,Self-supervised Learning,FALSE,#N/A,,,A machine learning that is intermediate between supervised and unsupervised learning and predicts parts of the input data from other observed parts without relying on human-annotated labels.,A machine learning task that is intermediate between supervised and unsupervised learning and predicts parts of the input data from other observed parts without relying on human-annotated labels.,https://en.wikipedia.org/wiki/Self-supervised_learning|,,,AIO:MachineLearningTask
AIO:MultimodalLearning,AIO:NetworkSubset,,,Multimodal Learning,FALSE,0.42,"A type of deep learning that uses multiple modalities of data, such as text, audio, and images, to improve learning outcomes.","A type of deep learning that uses multiple modalities of data, such as text, audio, and images, to improve learning outcomes.",A type of machine learning that uses multiple modalities of data such as text audio and images to improve learning outcomes.,A machine learning task that uses multiple modalities of data such as text audio and images to improve learning outcomes.,https://doi.org/10.6028/NIST.SP.1270,,,AIO:MachineLearningTask
AIO:ExponentialFunction,AIO:FunctionSubset,,,Exponential Function,FALSE,0.47,The exponential function is a mathematical function denoted by f(x)=exp or e^{x}.,The exponential function is a mathematical function denoted by f(x)=exp or e^{x}.,An activation function that is the mathematical function denoted by f(x)=exp or e^{x}.,A mathematical function denoted by f(x)=exp or e^{x}.,https://www.tensorflow.org/api_docs/python/tf/keras/activations/exponential,,,AIO:MathematicalFunction
AIO:GELUFunction,AIO:FunctionSubset,Gaussian Error Linear Unit|GELU,,GELU Function,FALSE,0.58,"Gaussian error linear unit (GELU) computes x * P(X <= x), where P(X) ~ N(0, 1). The (GELU) nonlinearity weights inputs by their value, rather than gates inputs by their sign as in ReLU.","Gaussian error linear unit (GELU) computes x * P(X <= x), where P(X) ~ N(0, 1). The (GELU) nonlinearity weights inputs by their value, rather than gates inputs by their sign as in ReLU.",An activation function that computes x * P(X <= x) where P(X) ~ N(0 1) weighting inputs by their value rather than gating inputs by their sign as in ReLU.,A mathematical function that computes x * P(X <= x) where P(X) ~ N(0 1) weighting inputs by their value rather than gating inputs by their sign as in ReLU.,https://www.tensorflow.org/api_docs/python/tf/keras/activations/gelu,,,AIO:MathematicalFunction
AIO:HardSigmoidFunction,AIO:FunctionSubset,,,Hard Sigmoid Function,FALSE,0.71,A faster approximation of the sigmoid activation. Piecewise linear approximation of the sigmoid function. Ref: 'https://en.wikipedia.org/wiki/Hard_sigmoid',A faster approximation of the sigmoid activation. Piecewise linear approximation of the sigmoid function. Ref: 'https://en.wikipedia.org/wiki/Hard_sigmoid',An activation function that is a faster approximation of the sigmoid activation using a piecewise linear approximation.,A mathematical function that is a faster approximation of the sigmoid activation using a piecewise linear approximation.,https://www.tensorflow.org/api_docs/python/tf/keras/activations/hard_sigmoid,,,AIO:MathematicalFunction
AIO:MathematicalFunction,AIO:ClassSubset,,,Mathematical Function,FALSE,#N/A,A mathematical rule that gives the value of a dependent variable corresponding to specified values of one or more independent variables.,,#N/A,A mathematical rule that gives the value of a dependent variable corresponding to specified values of one or more independent variables.,https://www.sciencedirect.com/topics/mathematics/mathematical-function,,,owl:Thing
AIO:AddLayer,AIO:LayerSubset,,,Add Layer,FALSE,0.66,"Layer that adds a list of inputs. It takes as input a list of tensors, all of the same shape, and returns a single tensor (also of the same shape).","Layer that adds a list of inputs. It takes as input a list of tensors, all of the same shape, and returns a single tensor (also of the same shape).",A merging layer that adds a list of inputs taking as input a list of tensors all of the same shape.,A merging layer that adds a list of inputs taking as input a list of tensors all of the same shape.,https://www.tensorflow.org/api_docs/python/tf/keras/layers/Add,,,AIO:MergingLayer
AIO:AverageLayer,AIO:LayerSubset,,,Average Layer,FALSE,0.63,"Layer that averages a list of inputs element-wise. It takes as input a list of tensors, all of the same shape, and returns a single tensor (also of the same shape).","Layer that averages a list of inputs element-wise. It takes as input a list of tensors, all of the same shape, and returns a single tensor (also of the same shape).",A merging layer that averages a list of inputs element-wise taking as input a list of tensors all of the same shape.,A merging layer that averages a list of inputs element-wise taking as input a list of tensors all of the same shape.,https://www.tensorflow.org/api_docs/python/tf/keras/layers/Average,,,AIO:MergingLayer
AIO:MaximumLayer,AIO:LayerSubset,,,Maximum Layer,FALSE,0.67,"Layer that computes the maximum (element-wise) a list of inputs. It takes as input a list of tensors, all of the same shape, and returns a single tensor (also of the same shape).","Layer that computes the maximum (element-wise) a list of inputs. It takes as input a list of tensors, all of the same shape, and returns a single tensor (also of the same shape).",A merging layer that computes the maximum (element-wise) of a list of inputs.,A merging layer that computes the maximum (element-wise) of a list of inputs.,https://www.tensorflow.org/api_docs/python/tf/keras/layers/Maximum,,,AIO:MergingLayer
AIO:MinimumLayer,AIO:LayerSubset,,,Minimum Layer,FALSE,0.67,"Layer that computes the minimum (element-wise) a list of inputs. It takes as input a list of tensors, all of the same shape, and returns a single tensor (also of the same shape).","Layer that computes the minimum (element-wise) a list of inputs. It takes as input a list of tensors, all of the same shape, and returns a single tensor (also of the same shape).",A merging layer that computes the minimum (element-wise) of a list of inputs.,A merging layer that computes the minimum (element-wise) of a list of inputs.,https://www.tensorflow.org/api_docs/python/tf/keras/layers/Minimum,,,AIO:MergingLayer
AIO:ConcatenateLayer,AIO:LayerSubset,,,Concatenate Layer,FALSE,0.56,"Layer that concatenates a list of inputs. It takes as input a list of tensors, all of the same shape except for the concatenation axis, and returns a single tensor that is the concatenation of all inputs.","Layer that concatenates a list of inputs. It takes as input a list of tensors, all of the same shape except for the concatenation axis, and returns a single tensor that is the concatenation of all inputs.",A merging layer that concatenates a list of inputs taking as input a list of tensors all of the same shape except for the concatenation axis.,A merging layer that concatenates a list of inputs taking as input a list of tensors all of the same shape except for the concatenation axis.,https://www.tensorflow.org/api_docs/python/tf/keras/layers/Concatenate,,,AIO:MergingLayer
AIO:MultiplyLayer,AIO:LayerSubset,,,Multiply Layer,FALSE,0.73,"Layer that multiplies (element-wise) a list of inputs. It takes as input a list of tensors, all of the same shape, and returns a single tensor (also of the same shape).","Layer that multiplies (element-wise) a list of inputs. It takes as input a list of tensors, all of the same shape, and returns a single tensor (also of the same shape).",A merging layer that multiplies (element-wise) a list of inputs.,A merging layer that multiplies (element-wise) a list of inputs.,https://www.tensorflow.org/api_docs/python/tf/keras/layers/Multiply,,,AIO:MergingLayer
AIO:SubtractLayer,AIO:LayerSubset,,,Subtract Layer,FALSE,0.87,"Layer that subtracts two inputs. It takes as input a list of tensors of size 2, both of the same shape, and returns a single tensor, (inputs[0] - inputs[1]), also of the same shape.","Layer that subtracts two inputs. It takes as input a list of tensors of size 2, both of the same shape, and returns a single tensor, (inputs[0] - inputs[1]), also of the same shape.",A merging layer that subtracts two inputs.,A merging layer that subtracts two inputs.,https://www.tensorflow.org/api_docs/python/tf/keras/layers/Subtract,,,AIO:MergingLayer
AIO:LanguageModel,AIO:ModelSubset,,,Language Model,FALSE,0.09,A language model is a probabilistic model designed to predict the next word in a sequence or assign probabilities to sequences of words in natural language.,,A model designed to predict the next word in a sequence or assign probabilities to sequences of words in natural language.,A model designed to predict the next word in a sequence or assign probabilities to sequences of words in natural language.,https://en.wikipedia.org/wiki/Language_model,,,AIO:Model
AIO:ThresholdAutoregressive,AIO:ModelSubset,TAR,,Threshold Autoregressive,FALSE,#N/A,,,"A model that allows for different autoregressive processes depending on the regime or state of the time series, enabling the capture of nonlinear behaviors.","A model that allows for different autoregressive processes depending on the regime or state of the time series, enabling the capture of nonlinear behaviors.",https://dx.doi.org/10.1080/01621459.1989.10478760,,,AIO:Model
AIO:DynamicConditionalCorrelation,AIO:ModelSubset,DCC,,Dynamic Conditional Correlation,FALSE,#N/A,,,"A model that allows for time-varying correlations between different time series, used in financial econometrics to model and forecast covariances.","A model that allows for time-varying correlations between different time series, used in financial econometrics to model and forecast covariances.",,,,AIO:Model
AIO:VectorAutoregression,AIO:ModelSubset,VAR,,Vector Autoregression,FALSE,#N/A,,,"A model that captures the linear interdependencies among multiple time series, where each variable is modeled as a linear function of its own past values and the past values of all other variables in the system.","A model that captures the linear interdependencies among multiple time series, where each variable is modeled as a linear function of its own past values and the past values of all other variables in the system.",,,,AIO:Model
AIO:AutoregressiveMovingAverage,AIO:ModelSubset,ARMA,,Autoregressive Moving Average,FALSE,#N/A,,,"A model that combines autoregressive (AR) and moving average (MA) components to represent time series data, suitable for stationary series without the need for differencing.","A model that combines autoregressive (AR) and moving average (MA) components to represent time series data, suitable for stationary series without the need for differencing.",,,,AIO:Model
AIO:ExponentialSmoothingStateSpaceModel,AIO:ModelSubset,ETS,,Exponential Smoothing State Space Model,FALSE,#N/A,,,"A model that combines exponential smoothing with state space modeling, allowing for the inclusion of both trend and seasonal components. Used in  forecasting.","A model that combines exponential smoothing with state space modeling, allowing for the inclusion of both trend and seasonal components. Used in  forecasting.",,,,AIO:Model
AIO:AutoregressiveConditionalHeteroskedasticity,AIO:ModelSubset,ARCH,,Autoregressive Conditional Heteroskedasticity,FALSE,#N/A,,,"A model that describes the variance of the current error term as a function of the previous periods' error terms, capturing volatility clustering. Used for time series data.","A model that describes the variance of the current error term as a function of the previous periods' error terms, capturing volatility clustering. Used for time series data.",,,,AIO:Model
AIO:SeasonalAutoregressiveIntegratedMovingAverage,AIO:ModelSubset,SARIMA,,Seasonal Autoregressive Integrated Moving-Average,FALSE,#N/A,,,"A model that extends ARIMA, explicitly supporting univariate time series data with a seasonal component, combining seasonal differencing with ARIMA modeling.","A model that extends ARIMA, explicitly supporting univariate time series data with a seasonal component, combining seasonal differencing with ARIMA modeling.",,,,AIO:Model
AIO:AutoregressiveDistributedLag,AIO:ModelSubset,ARDL,,Autoregressive Distributed Lag,FALSE,#N/A,,,"A model that includes lagged values of both the dependent variable and one or more independent variables, capturing dynamic relationships over time. Used in time series analysis.","A model that includes lagged values of both the dependent variable and one or more independent variables, capturing dynamic relationships over time. Used in time series analysis.",,,,AIO:Model
AIO:GeneralizedAutoregressiveConditionalHeteroskedasticity,AIO:ModelSubset,GARCH,,Generalized Autoregressive Conditional Heteroskedasticity,FALSE,#N/A,,,"A model that incorporates lagged conditional variances, allowing for more flexibility in modeling time-varying volatility.","A model that incorporates lagged conditional variances, allowing for more flexibility in modeling time-varying volatility.",,,,AIO:Model
AIO:AutoregressiveIntegratedMovingAverage,AIO:ModelSubset,ARIMA,,Autoregressive Integrated Moving Average,FALSE,#N/A,,,"A model which combines autoregression (AR), differencing (I), and moving average (MA) components. Used for analyzing and forecasting time series data.","A model which combines autoregression (AR), differencing (I), and moving average (MA) components. Used for analyzing and forecasting time series data.",,,,AIO:Model
AIO:ModularLLM,AIO:ModelSubset,Modular Large Language Model,component skills|skill composition,Modular LLM,FALSE,0.20,,,A modular large language model that consists of multiple specialized components or skills that can be dynamically composed and recombined to solve complex tasks mimicking the modular structure of human cognition.,A modular language model that consists of multiple specialized components or skills that can be dynamically composed and recombined to solve complex tasks mimicking the modular structure of human cognition.,https://arxiv.org/abs/2302.11529v2,,,AIO:ModularLanguageModel
AIO:MultimodalLLM,AIO:ModelSubset,Multimodal Large Language Model,cross-modal grounding,Multimodal LLM,FALSE,0.34,,,A multimodal large language model that learns joint representations across different modalities like text vision and audio in an end-to-end fashion for better cross-modal understanding and generation.,A multimodal large language model that learns joint representations across different modalities like text vision and audio in an end-to-end fashion for better cross-modal understanding and generation.,https://arxiv.org/abs/2303.17580,,,AIO:MultimodalLanguageModel
AIO:MultimodalPromptbasedLanguageModel,AIO:ModelSubset,,,Multimodal Prompt-based Language Model,FALSE,#N/A,,,"A multimodal LLM which processes prompts that include multiple modalities, such as both text and images, to generate relevant responses.","A multimodal large language model which processes prompts that include multiple modalities, such as both text and images, to generate relevant responses.",https://arxiv.org/abs/2210.03094,,,AIO:MultimodalLanguageModel
AIO:ArtificialNeuralNetwork,AIO:NetworkSubset,ANN|NN,,Artificial Neural Network,FALSE,0.58,"An artificial neural network (ANN) is based on a collection of connected units or nodes called artificial neurons, modeled after biological neurons, with connections transmitting signals processed by non-linear functions.","An artificial neural network (ANN) is based on a collection of connected units or nodes called artificial neurons, modeled after biological neurons, with connections transmitting signals processed by non-linear functions.",A network based on a collection of connected units called artificial neurons modeled after biological neurons.,A network based on a collection of connected units called artificial neurons modeled after biological neurons.,https://en.wikipedia.org/wiki/Artificial_neural_network,,,AIO:Network
AIO:UnsupervisedPretrainedNetwork,AIO:NetworkSubset,UPN,,Unsupervised Pretrained Network,FALSE,0.54,"Unsupervised pre-training initializes a discriminative neural net from one trained using an unsupervised criterion, aiding in optimization and overfitting issues.","Unsupervised pre-training initializes a discriminative neural net from one trained using an unsupervised criterion, aiding in optimization and overfitting issues.",A network that initializes a discriminative neural net from one trained using an unsupervised criterion.,A network that initializes a discriminative neural net from one trained using an unsupervised criterion.,https://metacademy.org/graphs/concepts/unsupervised_pre_training,,,AIO:Network
AIO:BayesianNetwork,AIO:NetworkSubset,,,Bayesian Network,FALSE,0.30,A probabilistic graphical model representing variables and their conditional dependencies via a directed acyclic graph (DAG).,,A network that is a probabilistic graphical model representing variables and their conditional dependencies via a directed acyclic graph.,A network that is a probabilistic graphical model representing variables and their conditional dependencies via a directed acyclic graph.,https://en.wikipedia.org/wiki/Bayesian_network,,,AIO:Network
AIO:MarkovChain,AIO:ModelSubset,MC|Markov Process|MP,,Markov Chain,FALSE,0.16,A Markov chain is a stochastic model describing a sequence of possible events where the probability of each event depends only on the previous event's state.,,A network that is a stochastic model describing a sequence of possible events where the probability of each event depends only on the previous event's state.,A network that is a stochastic model describing a sequence of possible events where the probability of each event depends only on the previous event's state.,https://en.wikipedia.org/wiki/Markov_chain,Layers: Probalistic Hidden,AIO:ProbabilisticHiddenLayer,AIO:Network
AIO:SymmetricallyConnectedNetwork,AIO:NetworkSubset,SCN,,Symmetrically Connected Network,FALSE,0.59,"Symmetrically connected networks are a type of recurrent neural network where connections between units are symmetrical, meaning they have equal weights in both directions. This structure allows the network to maintain consistent information flow and equilibrium.","Symmetrically connected networks are a type of recurrent neural network where connections between units are symmetrical, meaning they have equal weights in both directions. This structure allows the network to maintain consistent information flow and equilibrium.",A network that is a type of recurrent neural network where connections between units are symmetrical with equal weights in both directions.,A network that is a type of recurrent neural network where connections between units are symmetrical with equal weights in both directions.,https://ieeexplore.ieee.org/document/287176,,,AIO:Network
AIO:LiquidStateMachineNetwork,AIO:NetworkSubset,LSM,,Liquid State Machine Network,FALSE,0.50,"A liquid state machine (LSM) is a type of reservoir computer using a spiking neural network, with recurrently connected nodes turning time-varying input into spatio-temporal activation patterns.",,A network that is a type of reservoir computer turning time-varying input into spatio-temporal activation patterns.,A network that is a type of reservoir computer turning time-varying input into spatio-temporal activation patterns.,https://en.wikipedia.org/wiki/Liquid_state_machine,"Layers: Input, Spiking Hidden, Output",AIO:InputLayer|AIO:SpikingHiddenLayer|AIO:OutputLayer,AIO:Network
AIO:KohonenNetwork,AIO:NetworkSubset,KN|Self-Organizing Map|SOM|Self-Organizing Feature Map|SOFM,,Kohonen Network,FALSE,0.40,"A self-organizing map (SOM) or Kohonen network is an unsupervised machine learning technique producing a low-dimensional representation of high-dimensional data, preserving topological structure.",,A network that is an unsupervised technique producing a low-dimensional representation of high-dimensional data preserving topological structure.,A network that is an unsupervised technique producing a low-dimensional representation of high-dimensional data preserving topological structure.,https://en.wikipedia.org/wiki/Self-organizing_map,"Layers: Input, Hidden",AIO:InputLayer|AIO:HiddenLayer,AIO:Network
AIO:RecurrentNeuralNetwork,AIO:NetworkSubset,RecNN|Recurrent Network|RN,,Recurrent Neural Network,FALSE,0.35,"A recurrent neural network (RNN) has connections forming a directed graph along a temporal sequence, enabling dynamic temporal behavior.",,A deep neural network with connections forming a directed graph along a temporal sequence enabling dynamic behavior.,A network with connections forming a directed graph along a temporal sequence enabling dynamic behavior.,,,,AIO:Network
AIO:SupportVectorMachine,AIO:NetworkSubset,SVM|Supper Vector Network|SVN,,Support Vector Machine,FALSE,0.45,"Support vector machines (SVMs) are supervised learning models for classification and regression analysis, mapping training examples to points in space to maximize the gap between categories.",,A network with supervised learning models for classification and regression that maps training examples to points in space maximizing the gap between categories.,A network with supervised learning models for classification and regression that maps training examples to points in space maximizing the gap between categories.,https://en.wikipedia.org/wiki/Support-vector_machine,"Layers: Input, Hidden, Output",AIO:InputLayer|AIO:HiddenLayer|AIO:OutputLayer,AIO:Network
AIO:node2vecCBOW,AIO:NetworkSubset,N2V-CBOW,CBOW,node2vec-CBOW,FALSE,#N/A,,,"A node2vec that predicts the current node from a window of surrounding context nodes, with the order of context nodes not influencing prediction.","A node2vec that predicts the current node from a window of surrounding context nodes, with the order of context nodes not influencing prediction.",https://en.wikipedia.org/wiki/Node2vec,"Layers: Input, Hidden, Output",AIO:InputLayer|AIO:HiddenLayer|AIO:OutputLayer,AIO:node2vec
AIO:node2vecSkipGram,AIO:NetworkSubset,N2V-SkipGram,SkipGram,node2vec-SkipGram,FALSE,#N/A,,,"A node2vec that uses the current node to predict the surrounding window of context nodes, weighing nearby context nodes more heavily than distant ones.","A node2vec that uses the current node to predict the surrounding window of context nodes, weighing nearby context nodes more heavily than distant ones.",https://en.wikipedia.org/wiki/Node2vec,"Layers: Input, Hidden, Output",AIO:InputLayer|AIO:HiddenLayer|AIO:OutputLayer,AIO:node2vec
