AIO:MaxPooling1DLayer,AIO:LayerSubset,MaxPool1D|MaxPooling1D,,MaxPooling1D Layer,FALSE,0.91,"Max pooling operation for 1D temporal data. Downsamples the input representation by taking the maximum value over a spatial window of size pool_size. The window is shifted by strides. The resulting output, when using the ""valid"" padding option, has a shape of: output_shape = (input_shape - pool_size + 1) / strides) The resulting output shape when using the ""same"" padding option is: output_shape = input_shape / strides.","Max pooling operation for 1D temporal data. Downsamples the input representation by taking the maximum value over a spatial window of size pool_size. The window is shifted by strides. The resulting output, when using the ""valid"" padding option, has a shape of: output_shape = (input_shape - pool_size + 1) / strides) The resulting output shape when using the ""same"" padding option is: output_shape = input_shape / strides.",A pooling layer that performs max pooling operation for temporal data.,A pooling layer that performs max pooling operation for temporal data.,https://www.tensorflow.org/api_docs/python/tf/keras/layers/MaxPool1D,,,AIO:PoolingLayer
AIO:ModelEfficiency,AIO:PreprocessingSubset,Model Optimization|Computational Efficiency,,Model Efficiency,FALSE,0.17,"Techniques aimed at making models more efficient, such as knowledge distillation.",,Techniques aimed at making models more efficient such as knowledge distillation.,"A preprocessing aimed at making models more efficient, such as knowledge distillation.",https://doi.org/10.1145/3578938|,,,AIO:Preprocessing
AIO:DataPreparation,AIO:PreprocessingSubset,Data Curation|Data Processing|Data Assembly,,Data Preparation,FALSE,0.23,"The process of cleaning, transforming, and organizing raw data into a suitable format for analysis and modeling, ensuring the quality and relevance of the data for machine learning tasks.",,The process of cleaning transforming and organizing raw data into a suitable format for analysis and modeling ensuring the quality and relevance of the data for machine learning tasks.,"A preprocessing that cleans, transforms and organizes raw data into a suitable format for analysis and modeling, ensuring the quality and relevance of the data for machine learning tasks.",,,,AIO:Preprocessing
AIO:Distillation,AIO:PreprocessingSubset,Refining|Purification,Knowledge compression|Teacher-student model,Distillation,FALSE,0.04,"The process of training a smaller model to replicate the behavior of a larger model, aiming to compress the knowledge into a more compact form without significant loss of performance.",,The process of training a smaller model to replicate the behavior of a larger model aiming to compress the knowledge into a more compact form without significant loss of performance.,A preprocessing that trains a smaller model to replicate the behavior of a larger model aiming to compress the knowledge into a more compact form without significant loss of performance.,https://doi.org/10.48550/arXiv.2105.13093|,,,AIO:Preprocessing
AIO:DataEnhancement,AIO:PreprocessingSubset,,,DataEnhancement,FALSE,0.38,"Techniques used to improve the quality, diversity, and volume of data available for training machine learning models, such as data augmentation, synthesis, and enrichment, to enhance model robustness and accuracy.",,Techniques used to improve the quality diversity and volume of data available for training machine learning models such as data augmentation synthesis and enrichment to enhance model robustness and accuracy.,"A preprocessing used to improve the quality diversity and volume of data available for training machine learning models, such as data augmentation synthesis and enrichment to enhance model robustness and accuracy.",,,,AIO:Preprocessing
AIO:TrainingStrategies,AIO:PreprocessingSubset,Learning Techniques|Instructional Methods,,Training Strategies,FALSE,0.12,"The methodologies and approaches used to train machine learning models, including techniques such as supervised learning, unsupervised learning, reinforcement learning, and transfer learning, aimed at optimizing model performance.",,The methodologies and approaches used to train machine learning models including techniques such as supervised learning unsupervised learning reinforcement learning and transfer learning aimed at optimizing model performance.,A preprocessing used to train machine learning models including techniques such as supervised learning unsupervised learning reinforcement learning and transfer learning aimed at optimizing model performance.,,,,AIO:Preprocessing
AIO:ProbabilisticTopicModel,AIO:MachineLearningSubset,,,Probabilistic Topic Model,FALSE,0.39,"Methods that use statistical techniques to analyze the words in each text to discover common themes, their connections, and their changes over time.",,A probabilistic graphical model that uses statistical techniques to analyze the words in each text to discover common themes their connections and their changes over time.,A probabilistic graphical model that uses statistical techniques to analyze the words in each text to discover common themes their connections and their changes over time.,https://pyro.ai/examples/prodlda.html|,,,AIO:ProbabilisticGraphicalModel
AIO:CausalGraphicalModel,AIO:MachineLearningSubset,Casaul Graph|Path Diagram|Casaul Bayesian Network|DAG|Directed Acyclic Graph,,Causal Graphical Model,FALSE,0.36,Probabilistic graphical models used to encode assumptions about the data-generating process.,,A probabilistic graphical model used to encode assumptions about the data-generating process.,A probabilistic graphical model used to encode assumptions about the data-generating process.,https://en.wikipedia.org/wiki/Causal_graph|,,,AIO:ProbabilisticGraphicalModel
AIO:InheritedBias,AIO:BiasSubset,,,Inherited Bias,FALSE,0.30,"Bias arising when machine learning applications generate inputs for other machine learning algorithms, passing on any existing bias.",,A processing bias arising when machine learning applications generate inputs for other machine learning algorithms passing on any existing bias.,A processing bias arising when machine learning applications generate inputs for other machine learning algorithms passing on any existing bias.,https://doi.org/10.6028/NIST.SP.1270,,,AIO:ProcessingBias
AIO:AmplificationBias,AIO:BiasSubset,,,Amplification Bias,FALSE,0.22,Bias arising when the distribution over prediction outputs is skewed compared to the prior distribution of the prediction target.,,A processing bias arising when the distribution over prediction outputs is skewed compared to the prior distribution of the prediction target.,A processing bias arising when the distribution over prediction outputs is skewed compared to the prior distribution of the prediction target.,https://royalsocietypublishing.org/doi/10.1098/rspb.2019.0165#d1e5237,,,AIO:ProcessingBias
AIO:ErrorPropagationBias,AIO:BiasSubset,Error Propagation,,Error Propagation Bias,FALSE,0.33,"The effect of variables' uncertainties (or errors, more specifically random errors) on the uncertainty of a function based on them.",,A processing bias characterized by the effect of variables' uncertainties (or errors more specifically random errors) on the uncertainty of a function based on them.,A processing bias characterized by the effect of variables' uncertainties (or errors more specifically random errors) on the uncertainty of a function based on them.,https://doi.org/10.6028/NIST.SP.1270,,,AIO:ProcessingBias
AIO:SurvivorshipBias,AIO:BiasSubset,,,Survivorship Bias,FALSE,0.48,"The tendency to focus on items, observations, or people that ""survive"" a selection process, overlooking those that did not.","The tendency to focus on items, observations, or people that ""survive"" a selection process, overlooking those that did not.","A processing bias characterized by the tendency to focus on items observations or people that ""survive"" a selection process overlooking those that did not.","A processing bias characterized by the tendency to focus on items observations or people that ""survive"" a selection process overlooking those that did not.",https://doi.org/10.6028/NIST.SP.1270,,,AIO:ProcessingBias
AIO:ModelSelectionBias,AIO:BiasSubset,,,Model Selection Bias,FALSE,0.21,"Bias introduced when using data to select a single ""best"" model from many, or when an explanatory variable has a weak relationship with the response variable.",,"A processing bias introduced when using data to select a single ""best"" model from many or when an explanatory variable has a weak relationship with the response variable.","A processing bias introduced when using data to select a single ""best"" model from many or when an explanatory variable has a weak relationship with the response variable.",https://doi.org/10.6028/NIST.SP.1270,,,AIO:ProcessingBias
AIO:TimeDistributedLayer,AIO:LayerSubset,,,TimeDistributed Layer,FALSE,0.85,"This wrapper allows to apply a layer to every temporal slice of an input. Every input should be at least 3D, and the dimension of index one of the first input will be considered to be the temporal dimension. Consider a batch of 32 video samples, where each sample is a 128x128 RGB image with channels_last data format, across 10 timesteps. The batch input shape is (32, 10, 128, 128, 3). You can then use TimeDistributed to apply the same Conv2D layer to each of the 10 timesteps, independently:","This wrapper allows to apply a layer to every temporal slice of an input. Every input should be at least 3D, and the dimension of index one of the first input will be considered to be the temporal dimension. Consider a batch of 32 video samples, where each sample is a 128x128 RGB image with channels_last data format, across 10 timesteps. The batch input shape is (32, 10, 128, 128, 3). You can then use TimeDistributed to apply the same Conv2D layer to each of the 10 timesteps, independently:",A wrapper layer that applies a layer to every temporal slice of an input.,A recurrent layer that applies a layer to every temporal slice of an input.,https://www.tensorflow.org/api_docs/python/tf/keras/layers/TimeDistributed,,,AIO:RecurrentLayer
AIO:SimpleRNNLayer,AIO:LayerSubset,,,SimpleRNN Layer,FALSE,0.44,Fully-connected RNN where the output is to be fed back to input.,Fully-connected RNN where the output is to be fed back to input.,A recurrent layer that implements a fully-connected RNN where the output is to be fed back to input.,A recurrent layer that implements a fully-connected RNN where the output is to be fed back to input.,https://www.tensorflow.org/api_docs/python/tf/keras/layers/SimpleRNN,,,AIO:RecurrentLayer
AIO:GRULayer,AIO:LayerSubset,,,GRU Layer,FALSE,0.96,"Gated Recurrent Unit - Cho et al. 2014. Based on available runtime hardware and constraints, this layer will choose different implementations (cuDNN-based or pure-TensorFlow) to maximize the performance. If a GPU is available and all the arguments to the layer meet the requirement of the cuDNN kernel (see below for details), the layer will use a fast cuDNN implementation. The requirements to use the cuDNN implementation are: activation == tanh, recurrent_activation == sigmoid, recurrent_dropout == 0, unroll is False, use_bias is True, reset_after is True. Inputs, if use masking, are strictly right-padded. Eager execution is enabled in the outermost context. There are two variants of the GRU implementation. The default one is based on v3 and has reset gate applied to hidden state before matrix multiplication. The other one is based on original and has the order reversed. The second variant is compatible with CuDNNGRU (GPU-only) and allows inference on CPU. Thus it has separate biases for kernel and recurrent_kernel. To use this variant, set reset_after=True and recurrent_activation='sigmoid'.","Gated Recurrent Unit - Cho et al. 2014. Based on available runtime hardware and constraints, this layer will choose different implementations (cuDNN-based or pure-TensorFlow) to maximize the performance. If a GPU is available and all the arguments to the layer meet the requirement of the cuDNN kernel (see below for details), the layer will use a fast cuDNN implementation. The requirements to use the cuDNN implementation are: activation == tanh, recurrent_activation == sigmoid, recurrent_dropout == 0, unroll is False, use_bias is True, reset_after is True. Inputs, if use masking, are strictly right-padded. Eager execution is enabled in the outermost context. There are two variants of the GRU implementation. The default one is based on v3 and has reset gate applied to hidden state before matrix multiplication. The other one is based on original and has the order reversed. The second variant is compatible with CuDNNGRU (GPU-only) and allows inference on CPU. Thus it has separate biases for kernel and recurrent_kernel. To use this variant, set reset_after=True and recurrent_activation='sigmoid'.",A recurrent layer that implements the Gated Recurrent Unit architecture.,A recurrent layer that implements the Gated Recurrent Unit architecture.,https://www.tensorflow.org/api_docs/python/tf/keras/layers/GRU,,,AIO:RecurrentLayer
AIO:LSTMLayer,AIO:LayerSubset,,,LSTM Layer,FALSE,0.94,"Long Short-Term Memory layer - Hochreiter 1997. Based on available runtime hardware and constraints, this layer will choose different implementations (cuDNN-based or pure-TensorFlow) to maximize the performance. If a GPU is available and all the arguments to the layer meet the requirement of the cuDNN kernel (see below for details), the layer will use a fast cuDNN implementation. The requirements to use the cuDNN implementation are: 1. activation == tanh, 2. recurrent_activation == sigmoid, 3. recurrent_dropout == 0, 4. unroll is False, 5. use_bias is True, 6. Inputs, if use masking, are strictly right-padded, 7. Eager execution is enabled in the outermost context.","Long Short-Term Memory layer - Hochreiter 1997. Based on available runtime hardware and constraints, this layer will choose different implementations (cuDNN-based or pure-TensorFlow) to maximize the performance. If a GPU is available and all the arguments to the layer meet the requirement of the cuDNN kernel (see below for details), the layer will use a fast cuDNN implementation. The requirements to use the cuDNN implementation are: 1. activation == tanh, 2. recurrent_activation == sigmoid, 3. recurrent_dropout == 0, 4. unroll is False, 5. use_bias is True, 6. Inputs, if use masking, are strictly right-padded, 7. Eager execution is enabled in the outermost context.",A recurrent layer that implements the Long Short-Term Memory architecture.,A recurrent layer that implements the Long Short-Term Memory architecture.,https://www.tensorflow.org/api_docs/python/tf/keras/layers/LSTM,,,AIO:RecurrentLayer
AIO:BidirectionalLayer,AIO:LayerSubset,,,Bidirectional Layer,FALSE,0.73,Bidirectional wrapper for RNNs.,Bidirectional wrapper for RNNs.,A recurrent layer that is a bidirectional wrapper for RNNs.,A recurrent layer that is a bidirectional wrapper for RNNs.,https://www.tensorflow.org/api_docs/python/tf/keras/layers/Bidirectional,,,AIO:RecurrentLayer
AIO:UnitNormalizationLayer,AIO:LayerSubset,,,UnitNormalization Layer,FALSE,0.43,Unit normalization layer. Normalize a batch of inputs so that each input in the batch has a L2 norm equal to 1 (across the axes specified in axis).,Unit normalization layer. Normalize a batch of inputs so that each input in the batch has a L2 norm equal to 1 (across the axes specified in axis).,A normalization layer that normalizes a batch of inputs so that each input in the batch has a L2 norm equal to 1.,A recurrent layer that normalizes a batch of inputs so that each input in the batch has a L2 norm equal to 1.,https://www.tensorflow.org/api_docs/python/tf/keras/layers/UnitNormalization,,,AIO:RecurrentLayer
AIO:EchoStateNetwork,AIO:NetworkSubset,ESN,,Echo State Network,FALSE,0.53,"An echo state network (ESN) is a type of reservoir computer with a recurrent neural network and a sparsely connected hidden layer, learning output neuron weights to produce temporal patterns.",,A recurrent neural network with a recurrent hidden layer and sparsely connected hidden neurons that learns output weights to produce temporal patterns.,A recurrent neural network with a recurrent hidden layer and sparsely connected hidden neurons that learns output weights to produce temporal patterns.,https://en.wikipedia.org/wiki/Echo_state_network,"Layers: Input, Recurrent, Output",AIO:InputLayer|AIO:RecurrentLayer|AIO:OutputLayer,AIO:RecurrentNeuralNetwork
AIO:LongShortTermMemory,AIO:NetworkSubset,LSTM,,Long Short Term Memory,FALSE,0.77,"Long short-term memory (LSTM) networks are artificial recurrent neural networks with feedback connections, processing entire sequences of data for tasks like handwriting and speech recognition.",,A recurrent neural network with feedback connections that processes entire sequences of data.,A recurrent neural network with feedback connections that processes entire sequences of data.,https://en.wikipedia.org/wiki/Long_short-term_memory,"Layers: Input, Memory Cell, Output",AIO:InputLayer|AIO:MemoryCellLayer|AIO:OutputLayer,AIO:RecurrentNeuralNetwork
AIO:ProportionalHazardsModel,AIO:MachineLearningSubset,,,Proportional Hazards Model,FALSE,0.17,A survival modeling method where the unique effect of a unit increase in a covariate is multiplicative with respect to the hazard rate.,,A regression analysis method for survival analysis where the unique effect of a unit increase in a covariate is multiplicative with respect to the hazard rate.,A regression analysis for survival analysis where the unique effect of a unit increase in a covariate is multiplicative with respect to the hazard rate.,https://en.wikipedia.org/wiki/Proportional_hazards_model,,,AIO:SurvivalAnalysis
AIO:FixedEffectsModel,AIO:MachineLearningSubset,FEM,,Fixed Effects Model,FALSE,0.21,A statistical model in which the model parameters are fixed or non-random quantities.,,A regression analysis model in which the model parameters are fixed or non-random quantities.,A regression analysis in which the model parameters are fixed or non-random quantities.,https://en.wikipedia.org/wiki/Fixed_effects_model|,,,AIO:RegressionAnalysis
AIO:RidgeRegression,AIO:MachineLearningSubset,,,Ridge Regression,FALSE,0.20,A method of estimating the coefficients of multiple regression models in scenarios where the independent variables are highly correlated.,,A regression analysis method that estimates the coefficients of multiple regression models in scenarios where the independent variables are highly correlated.,A regression analysis that estimates the coefficients of multiple regression models in scenarios where the independent variables are highly correlated.,https://en.wikipedia.org/wiki/Ridge_regression|,,,AIO:RegressionAnalysis
AIO:LogisticRegression,AIO:MachineLearningSubset,,,Logistic Regression,FALSE,0.12,A statistical model that estimates the probability of an event occurring by modeling the log-odds of the event as a linear combination of one or more independent variables.,,A regression analysis model that estimates the probability of an event occurring by modeling the log-odds of the event as a linear combination of one or more independent variables.,A regression analysis that estimates the probability of an event occurring by modeling the log-odds of the event as a linear combination of one or more independent variables.,https://en.wikipedia.org/wiki/Logistic_regression|,,,AIO:RegressionAnalysis
AIO:LinearRegression,AIO:MachineLearningSubset,,,Linear Regression,FALSE,0.23,A linear approach for modeling the relationship between a scalar response and one or more explanatory variables.,,A regression analysis model that is a linear approach for modeling the relationship between a scalar response and one or more explanatory variables.,A regression analysis that is a linear approach for modeling the relationship between a scalar response and one or more explanatory variables.,https://en.wikipedia.org/wiki/Linear_regression|,,,AIO:RegressionAnalysis
AIO:LassoRegression,AIO:MachineLearningSubset,,,Lasso Regression,FALSE,0.00,A regression analysis method that performs both variable selection and regularization to enhance prediction accuracy and interpretability.,,A regression analysis method that performs both variable selection and regularization to enhance prediction accuracy and interpretability.,A regression analysis that performs both variable selection and regularization to enhance prediction accuracy and interpretability.,https://en.wikipedia.org/wiki/Lasso_(statistics)|,,,AIO:RegressionAnalysis
AIO:GeneralizedLinearModel,AIO:MachineLearningSubset,GLM,,Generalized Linear Model,FALSE,0.07,A model that generalizes linear regression by relating the linear model to the response variable via a link function and allowing the variance of each measurement to be a function of its predicted value.,,A machine learning model that generalizes linear regression by relating the linear model to the response variable via a link function and allowing the variance of each measurement to be a function of its predicted value.,A regression analysis that relates the linear model to the response variable via a link function and allowing the variance of each measurement to be a function of its predicted value.,https://en.wikipedia.org/wiki/Generalized_linear_model|,,,AIO:RegressionAnalysis
AIO:SpatialRegression,AIO:MachineLearningSubset,,,Spatial Regression,FALSE,0.11,A regression method used to model spatial relationships.,,A regression analysis method used to model spatial relationships.,A regression analysis used to model spatial relationships.,https://gisgeography.com/spatial-regression-models-arcgis/|,,,AIO:RegressionAnalysis
AIO:RandomEffectsModel,AIO:MachineLearningSubset,REM,,Random Effects Model,FALSE,0.27,A statistical model where the model parameters are random variables.,,A regression analysis model where the model parameters are random variables.,A regression analysis where the model parameters are random variables.,https://en.wikipedia.org/wiki/Random_effects_model|,,,AIO:RegressionAnalysis
AIO:LeastsquaresAnalysis,AIO:MachineLearningSubset,,,Least-squares Analysis,FALSE,#N/A,,,A regression analysis which approximates the solution of overdetermined systems by minimizing the sum of the squares of the residuals.,A regression analysis which approximates the solution of overdetermined systems by minimizing the sum of the squares of the residuals.,https://en.wikipedia.org/wiki/Least_squares|,,,AIO:RegressionAnalysis
AIO:GaussianNoiseLayer,AIO:LayerSubset,,,GaussianNoise Layer,FALSE,0.89,"Apply additive zero-centered Gaussian noise. This is useful to mitigate overfitting (you could see it as a form of random data augmentation). Gaussian Noise (GS) is a natural choice as corruption process for real valued inputs. As it is a regularization layer, it is only active at training time.","Apply additive zero-centered Gaussian noise. This is useful to mitigate overfitting (you could see it as a form of random data augmentation). Gaussian Noise (GS) is a natural choice as corruption process for real valued inputs. As it is a regularization layer, it is only active at training time.",A regularization layer that applies additive zero-centered Gaussian noise.,A regularization layer that applies additive zero-centered Gaussian noise.,https://www.tensorflow.org/api_docs/python/tf/keras/layers/GaussianNoise,,,AIO:RegularizationLayer
AIO:AlphaDropoutLayer,AIO:LayerSubset,,,AlphaDropout Layer,FALSE,0.74,"Applies Alpha Dropout to the input. Alpha Dropout is a Dropout that keeps mean and variance of inputs to their original values, in order to ensure the self-normalizing property even after this dropout. Alpha Dropout fits well to Scaled Exponential Linear Units by randomly setting activations to the negative saturation value.","Applies Alpha Dropout to the input. Alpha Dropout is a Dropout that keeps mean and variance of inputs to their original values, in order to ensure the self-normalizing property even after this dropout. Alpha Dropout fits well to Scaled Exponential Linear Units by randomly setting activations to the negative saturation value.",A regularization layer that applies Alpha Dropout to the input keeping mean and variance of inputs to ensure self-normalizing property.,A regularization layer that applies Alpha Dropout to the input keeping mean and variance of inputs to ensure self-normalizing property.,https://www.tensorflow.org/api_docs/python/tf/keras/layers/AlphaDropout,,,AIO:RegularizationLayer
AIO:ActivityRegularizationLayer,AIO:LayerSubset,,,ActivityRegularization Layer,FALSE,0.31,Layer that applies an update to the cost function based input activity.,,A regularization layer that applies an update to the cost function based on input activity.,A regularization layer that applies an update to the cost function based on input activity.,https://www.tensorflow.org/api_docs/python/tf/keras/layers/ActivityRegularization,,,AIO:RegularizationLayer
